{
  "id": "e3",
  "stage": "v3-check-envelope",
  "input": {
    "schema_version": "1",
    "document_b64": "eyJmb3JtYXQiOiJodHRwczovL3RpbmZvaWwuc2gvcHJlZGljYXRlL2F0dGVzdGF0aW9uL3YzIiwiY2hhbGxlbmdlIjp7Im5vbmNlIjoiMDAwMTAyMDMwNDA1MDYwNzA4MDkwYTBiMGMwZDBlMGYxMDExMTIxMzE0MTUxNjE3MTgxOTFhMWIxYzFkMWUxZiIsInJlcG9ydF9kYXRhIjoiMGE1MzI2NmFlNWYxZGVkOWI3ZTlkZTQ3NjJkYWFiYTAzYTE2ZjI4ZmUyM2VlOTFkOTQ3MWQ2MDk4NWM1MjkxYjAwMDAwMDAwMDAwMDAwMDAwMDAwMDAwMDAwMDAwMDAwMDAwMDAwMDAwMDAwMDAwMDAwMDAwMDAwMDAwMDAwMDAiLCJyZXBvcnRfZGF0YV9hbGdvcml0aG0iOiJodHRwczovL3RpbmZvaWwuc2gvcmVwb3J0LWRhdGEvdjEifSwiY3B1X2V2aWRlbmNlIjp7ImZvcm1hdCI6Imh0dHBzOi8vdGluZm9pbC5zaC9mb3JtYXQvc2V2LXNucC1yZXBvcnQvdjEiLCJyZXBvcnRfYmFzZTY0Ijoi/0FBQUFBQUFBQUFBQUFBQUFBQUFBQUFBQUFBQUFBQUFBQUFBQUFBQUFBQUFBQUFBQUFBQUFBQUFBQUFBQUFBQUFBQUFBQUFBQUFBQUFBQUFBQUFBQUFBQUFBQUFBQUFBQUFBQUFBQUFBQUFBQUFBQUFBQUFBQUFBQUFBQUFBQUFBQUFBQUFBQUFBQUFBQUFBQUFBQUFBQUFBQUFBQUFBQUFBQUFBQUFBQUFBQUFBQUFBQUFBQUFBQUFBQUFBQUFBQUFBQUFBQUFBQUFBQUFBQUFBQUFBQUFBQUFBQUFBQUFBQUFBQUFBQUFBQUFBQUFBQUFBQUFBQUFBQUFBQUFBQUFBQUFBQUFBQUFBQUFBQUFBQUFBQUFBQUFBQUFBQUFBQUFBQUFBQUFBQUFBQUFBQUFBQUFBQUFBQUFBQUFBQUFBQUFBQUFBQUFBQUFBQUFBQUFBQUFBQUFBQUFBQUFBQUFBQUFBQUFBQUFBQUFBQUFBQUFBQUFBQUFBQUFBQUFBQUFBQUFBQUFBQUFBQUFBQUFBQUFBQUFBQUFBQUFBQUFBQUFBQUFBQUFBQUFBQUFBQUFBQUFBQUFBQUFBQUFBQUFBQUFBQUFBQUFBQUFBQUFBQUFBQUFBQUFBQUFBQUFBQUFBQUFBQUFBQUFBQUFBQUFBQUFBQUFBQUFBQUFBQUFBQUFBQUFBQUFBQUFBQUFBQUFBQUFBQUFBQUFBQUFBQUFBQUFBQUFBQUFBQUFBQUFBQUFBQUFBQUFBQUFBQUFBQUFBQUFBQUFBQUFBQUFBQUFBQUFBQUFBQUFBQUFBQUFBQUFBQUFBQUFBQUFBQUFBQUFBQUFBQUFBQUFBQUFBQUFBQUFBQUFBQUFBQUFBQUFBQUFBQUFBQUFBQUFBQUFBQUFBQUFBQUFBQUFBQUFBQUFBQUFBQUFBQUFBQUFBQUFBQUFBQUFBQUFBQUFBQUFBQUFBQUFBQUFBQUFBQUFBQUFBQUFBQUFBQUFBQUFBQUFBQUFBQUFBQUFBQUFBQUFBQUFBQUFBQUFBQUFBQUFBQUFBQUFBQUFBQUFBQUFBQUFBQUFBQUFBQUFBQUFBQUFBQUFBQUFBQUFBQUFBQUFBQUFBQUFBQUFBQUFBQUFBQUFBQUFBQUFBQUFBQUFBQUFBQUFBQUFBQUFBQUFBQUFBQUFBQUFBQUFBQUFBQUFBQUFBQUFBQUFBQUFBQUFBQUFBQUFBQUFBQUFBQUFBQUFBQUFBQUFBQUFBQUFBQUFBQUFBQUFBQUFBQUFBQUFBQUFBQUFBQUFBQUFBQUFBQUFBQUFBQUFBQUFBQUFBQUFBQUFBQUFBQUFBQUFBQUFBQUFBQUFBQUFBQUFBQUFBQUFBQUFBQUFBQUFBQUFBQUFBQUFBQUFBQUFBQUFBQUFBQUFBQUFBQUFBQUFBQUFBQUFBQUFBQUFBQUFBQUFBQUFBQUFBQUFBQUFBQUFBQUFBQUFBQUFBQUFBQUFBQUFBQUFBQUFBQUFBQUFBQUFBQUFBQUFBQUFBQUFBQUFBQUFBQUFBQUFBQUFBQUFBQUFBQUFBQUFBQUFBQUFBQUFBQUFBQUFBQUFBQUFBQUFBQUFBQUFBQUFBQUFBQUFBQUFBQUFBQUFBQUFBQUFBQUFBQUFBQUFBQUFBQUFBQUFBQUFBQUFBQUFBQUFBQUFBQUFBQUFBQUFBQUFBQUFBQUFBQUFBQUFBQUFBQUFBQUFBQUFBQUFBQUFBQUFBQUFBQUFBQUFBQUFBQUFBQUFBQUFBQUFBQUFBQUFBQUFBQUFBQUFBQUFBQUFBQUFBQUFBQUFBQUFBQUFBQUFBQUFBQUFBQUFBQUFBQUFBQUFBQUFBQUFBQUFBQUFBQUFBQUFBQUFBQUFBQUFBQUFBQUFBQUFBQUFBQUFBQUFBQUFBQUFBQUFBQUFBQUFBQUFBQUFBQUFBQUFBQUFBQUFBQUFBQUFBQUFBQUFBQUFBQUFBQUFBQUFBQUFBQUFBQUFBQUFBQUFBQUFBQUFBQUFBQUFBQUFBQUFBQUFBQUFBQUFBQUFBQUFBQUFBQUFBQUFBQUFBQUFBQUFBQUFBQUFBQUFBQUFBQUFBQUFBQUFBQUFBQUFBQUE9IiwiZW5kb3JzZWQiOnsiY3J5cHRvX21hdGVyaWFsX2hhc2giOiJjODQzODJjNmNhODk4OWM5MTlhYWRhZDY5NzlhOTE3YzI0M2ZjMDVkY2M1NDI1MzVmNWY2MThjMzFjMGNlZjE5IiwiZGV2aWNlX2V2aWRlbmNlX2hhc2giOiI1ZTg0ZjYzMmUwMTI5M2JmZjQ1OTZjZjcyYzQ1ZGUwZjllMTAzN2U1Y2RhMzIzMmI4NTBjNDc4ZDFhNmI1OTJiIn19LCJjcnlwdG9fbWF0ZXJpYWwiOiJleUptYjNKdFlYUWlPaUpvZEhSd2N6b3ZMM1JwYm1admFXd3VjMmd2WTNKNWNIUnZMVzFoZEdWeWFXRnNMM1l4SWl3aWFYUmxiWE1pT2x0ZGZRPT0iLCJkZXZpY2VfZXZpZGVuY2UiOiJleUptYjNKdFlYUWlPaUpvZEhSd2N6b3ZMM1JwYm1admFXd3VjMmd2WkdWMmFXTmxMV1YyYVdSbGJtTmxMM1l4SWl3aWFYUmxiWE1pT2x0ZGZRPT0iLCJjb2xsYXRlcmFsIjpbXX0=",
    "nonce_hex": "000102030405060708090a0b0c0d0e0f101112131415161718191a1b1c1d1e1f",
    "repo": "tinfoilsh/confidential-inference-proxy"
  },
  "expected": {
    "accepted": false,
    "code": "ENVELOPE_REJECTED"
  }
}
