{
  "id": "struct-no-vcek",
  "stage": "v3-authenticate-quote",
  "input": {
    "schema_version": "1",
    "document_b64": "eyJmb3JtYXQiOiJodHRwczovL3RpbmZvaWwuc2gvcHJlZGljYXRlL2F0dGVzdGF0aW9uL3YzIiwiY2hhbGxlbmdlIjp7Im5vbmNlIjoiMDAwMTAyMDMwNDA1MDYwNzA4MDkwYTBiMGMwZDBlMGYxMDExMTIxMzE0MTUxNjE3MTgxOTFhMWIxYzFkMWUxZiIsInJlcG9ydF9kYXRhIjoiMGE1MzI2NmFlNWYxZGVkOWI3ZTlkZTQ3NjJkYWFiYTAzYTE2ZjI4ZmUyM2VlOTFkOTQ3MWQ2MDk4NWM1MjkxYjAwMDAwMDAwMDAwMDAwMDAwMDAwMDAwMDAwMDAwMDAwMDAwMDAwMDAwMDAwMDAwMDAwMDAwMDAwMDAwMDAwMDAiLCJyZXBvcnRfZGF0YV9hbGdvcml0aG0iOiJodHRwczovL3RpbmZvaWwuc2gvcmVwb3J0LWRhdGEvdjEifSwiY3B1X2V2aWRlbmNlIjp7ImZvcm1hdCI6Imh0dHBzOi8vdGluZm9pbC5zaC9mb3JtYXQvc2V2LXNucC1yZXBvcnQvdjEiLCJyZXBvcnRfYmFzZTY0IjoiQXdBQUFBQUFBQUFBQUFNQUFBQUFBQUFBQUFBQUFBQUFBQUFBQUFBQUFBQUFBQUFBQUFBQUFBQUFBQUFBQUFBQUFBQUFBQUVBQUFBSEFBQUFBQUFVU0FBQUFBQUFBQUFBQUFBQUFBQUFBQUFBQUFBQUFBQUFBQUFBQUFBQUFBQUFBQUFBQUFBQUFBQUFBQUFBQUFBQUFBQUFBQUFBQUFBQUFBQUFBQUFBQUFBQUFBQUFBQUFBQUFBQUFBQUFBQUFBcXFxcXFxcXFxcXFxcXFxcXFxcXFxcXFxcXFxcXFxcXFxcXFxcXFxcXFxcXFxcXFxcXFxcXFxcXFxcXFxcXFxcUFBQUFBQUFBQUFBQUFBQUFBQUFBQUFBQUFBQUFBQUFBQUFBQUFBQUFBQUFBQUFBQUFBQUFBQUFBQUFBQUFBQUFBQUFBQUFBQUFBQUFBQUFBQUFBQUFBQUFBQUFBQUFBQUFBQUFBQUFBQUFBQUFBQUFBQUFBQUFBQUFBQUFBQUFBQUFBQUFBQUFBQUFBQUFBQUFBQUFBQUFBQUFBQUFBQUFBQUFBQUFBQUFBQUFBQUFBQUFBQUFBQUFBQUFBQUFBQUFBQUFBQUFBQUFBQUFBQUFBQUFBQUFBQUFBQUFBQUFBQUFBQUFBQUFBQUFBQUFBQUFBQUFBQUFBQUFBQUFBQUFCd0FBQUFBQUZFZ1pFUUFBQUFBQUFBQUFBQUFBQUFBQUFBQUFBQUFBQUFBUkVSRVJFUkVSRVJFUkVSRVJFUkVSRVJFUkVSRVJFUkVSRVJFUkVSRVJFUkVSRVJFUkVSRVJFUkVSRVJFUkVSRVJFUkVSRVJFUkVSRVJFUkVSRVJFUkJ3QUFBQUFBRkVnVk53RUFGVGNCQUFjQUFBQUFBQlJJQUFBQUFBQUFBQUFBQUFBQUFBQUFBQUFBQUFBQUFBQUFBQUFBQUFBQUFBQUFBQUFBQUFBQUFBQUFBQUFBQUFBQUFBQUFBQUFBQUFBQUFBQUFBQUFBQUFBQUFBQUFBQUFBQUFBQUFBQUFBQUFBQUFBQUFBQUFBQUFBQUFBQUFBQUFBQUFBQUFBQUFBQUFBQUFBQUFBQUFBQUFBQUFBQUFBQUFBQUFBQUFBQUFBQUFBQUFBQUFBQUFBQUFBQUFBQUFBQUFBQUFBQUFBQUFBQUFBQUFBQUFBQUFBQUFBQUFBQUFhTVlTRFdFalBHUHhIVEV4VWZnRGQ1dTZtaWU0a0NQTExVK2NWbjZUcE11QnY1a25IUU0yT21OSjhQOVN2bGNNQUFBQUFBQUFBQUFBQUFBQUFBQUFBQUFBQUFBQUFBQUFJZnlBZ200bCtDRE9jdWpKSnorbFVIWTFvY2NrQUVrSktUS1UvNVo2YlBLK292elR5c1ZNd1RpYnVrVUlmKzUrQUFBQUFBQUFBQUFBQUFBQUFBQUFBQUFBQUFBQUFBQUFBQUFBQUFBQUFBQUFBQUFBQUFBQUFBQUFBQUFBQUFBQUFBQUFBQUFBQUFBQUFBQUFBQUFBQUFBQUFBQUFBQUFBQUFBQUFBQUFBQUFBQUFBQUFBQUFBQUFBQUFBQUFBQUFBQUFBQUFBQUFBQUFBQUFBQUFBQUFBQUFBQUFBQUFBQUFBQUFBQUFBQUFBQUFBQUFBQUFBQUFBQUFBQUFBQUFBQUFBQUFBQUFBQUFBQUFBQUFBQUFBQUFBQUFBQUFBQUFBQUFBQUFBQUFBQUFBQUFBQUFBQUFBQUFBQUFBQUFBQUFBQUFBQUFBQUFBQUFBQUFBQUFBQUFBQUFBQUFBQUFBQUFBQUFBQUFBQUFBQUFBQUFBQUFBQUFBQUFBQUFBQUFBQUFBQUFBQUFBQUFBQUFBQUFBQUFBQUFBQUFBQUFBQUFBQUFBQUFBQUFBQUFBQUFBQUFBQUFBQUFBQUFBQUFBQUFBQUFBQUFBQUFBQUFBQUFBQUFBQUFBQUFBQUFBQUFBQUFBQUFBQUFBQUFBQUFBQUFBQUFBQUFBQUFBQUFBQUFBQUFBQUFBQUFBQUFBQUFBQUFBQUFBQUFBQUFBQUFBQUFBQUFBQUFBQUFBQUFBQUFBQUFBQUFBQUFBQUFBQUFBQUFBQUFBQUFBQT0iLCJlbmRvcnNlZCI6eyJjcnlwdG9fbWF0ZXJpYWxfaGFzaCI6ImM4NDM4MmM2Y2E4OTg5YzkxOWFhZGFkNjk3OWE5MTdjMjQzZmMwNWRjYzU0MjUzNWY1ZjYxOGMzMWMwY2VmMTkiLCJkZXZpY2VfZXZpZGVuY2VfaGFzaCI6IjVlODRmNjMyZTAxMjkzYmZmNDU5NmNmNzJjNDVkZTBmOWUxMDM3ZTVjZGEzMjMyYjg1MGM0NzhkMWE2YjU5MmIifX0sImNyeXB0b19tYXRlcmlhbCI6ImV5Sm1iM0p0WVhRaU9pSm9kSFJ3Y3pvdkwzUnBibVp2YVd3dWMyZ3ZZM0o1Y0hSdkxXMWhkR1Z5YVdGc0wzWXhJaXdpYVhSbGJYTWlPbHRkZlE9PSIsImRldmljZV9ldmlkZW5jZSI6ImV5Sm1iM0p0WVhRaU9pSm9kSFJ3Y3pvdkwzUnBibVp2YVd3dWMyZ3ZaR1YyYVdObExXVjJhV1JsYm1ObEwzWXhJaXdpYVhSbGJYTWlPbHRkZlE9PSIsImNvbGxhdGVyYWwiOlt7ImlkIjoiY3JsIiwicm9sZSI6ImVuZG9yc2VtZW50IiwiZm9ybWF0IjoiaHR0cHM6Ly90aW5mb2lsLnNoL2NvbGxhdGVyYWwvYW1kLWNybC92MSIsInN1YmplY3RzIjpbImNwdSJdLCJkYXRhIjp7ImNybF9kZXJfYmFzZTY0IjoiTUlJRExEQ0I0UUlCQVRCQkJna3Foa2lHOXcwQkFRb3dOS0FQTUEwR0NXQ0dTQUZsQXdRQ0FnVUFvUnd3R2dZSktvWklodmNOQVFFSU1BMEdDV0NHU0FGbEF3UUNBZ1VBb2dNQ0FUQXdlekVMTUFrR0ExVUVCaE1DVlZNeEN6QUpCZ05WQkFnTUFrTkJNUlF3RWdZRFZRUUhEQXRUWVc1MFlTQkRiR0Z5WVRFZk1CMEdBMVVFQ2d3V1FXUjJZVzVqWldRZ1RXbGpjbThnUkdWMmFXTmxjekVVTUJJR0ExVUVDd3dMUlc1bmFXNWxaWEpwYm1jeEVqQVFCZ05WQkFNTUNVRlNTeTFIWlc1dllSY05NalF4TWpNeE1EQXdNREF3V2hjTk16UXhNak13TURBd01EQXdXakJCQmdrcWhraUc5dzBCQVFvd05LQVBNQTBHQ1dDR1NBRmxBd1FDQWdVQW9Sd3dHZ1lKS29aSWh2Y05BUUVJTUEwR0NXQ0dTQUZsQXdRQ0FnVUFvZ01DQVRBRGdnSUJBSnNCUGRIOHFEa0JoRE9KTHV2RTdaUU1SVk43bWlMbHd5eVFjeHNyWXFOajEvVWNrR2Z6V1VVSmtwUVptd0RLNGh6dVJZaHpNZjZFM1MvZXVlWWh2a1dMK1pubEJvRklqOXZ3anJEMDdMeExRd0NhTVgyQitDOHVjZGlRbDBBWWFhaERNaER2UmljaUZhblJyVTdtM0Fja0p1TGtBTUNUdHJ3R0M5NzBmcGw2NGFIMHZMOElsTzZXUmR3bEZFSGdIUCtTMWhSQWpPa1ZZdW9ZdDhLNUVxbjVBSjR5UFZLeTBnTlFxbGRHalAvNWZZMnBmWjU0N3VtT0VieFNCaHJ4b1BHaHA0RHdlZWQyK1hsbHRiZWNaeXpFdXRUSFJNS25tVnpySW8wamROdE5WRjJjUG5SdGtjNVREVWZzQWl5L3lhMlEySlVybGZrMGVrT1hGWEE2QkIyRzVIbWhFUVVsbllpdWk5cTdGTmlCeU9HU1ZyTTcrWFNlcnRzQXlCODQzd1RVQVVsZW13aWR1emhvY1JnZmk4VXBkYjVidHlzTllnWDdiN09jTDhKakFWZ2JzcXpMb0Ywc2xkSXNsZmxCWGhFUC93R1FiVm12MkxFVXZ1SmUyRkF1TWwxR0cvY0hqZHBxbVBDbldVOEVQZXpua2NXV05rQjJhM3NlUTZwUmhwK1lLRkFZbXh3QytDc3Viamg1eVo4aGkyRG8vY0pLWDRtdEJHaG82WUV0eFkxS2dTV3A1RGJ2b3g3dklYZGxiMnFYZnFvMk4wSVkvU1duaE44azQ5a2lZUDgxclEzM3E0OEhlSkpCbmd1dUlTeVJidDZIaytqUlNoSER1NW5lSzBXQlMxSUh3OExtay8rVFFtZjNQeE5WSEJBT21sWXpxN3VVVU5yRHNmUDMifX1dfQ==",
    "nonce_hex": "",
    "repo": "tinfoilsh/confidential-inference-proxy",
    "amd_root_ca_pem": "-----BEGIN CERTIFICATE-----\nMIIGKDCCA9ygAwIBAgIBATBBBgkqhkiG9w0BAQowNKAPMA0GCWCGSAFlAwQCAgUA\noRwwGgYJKoZIhvcNAQEIMA0GCWCGSAFlAwQCAgUAogMCATAwezELMAkGA1UEBhMC\nVVMxCzAJBgNVBAgMAkNBMRQwEgYDVQQHDAtTYW50YSBDbGFyYTEfMB0GA1UECgwW\nQWR2YW5jZWQgTWljcm8gRGV2aWNlczEUMBIGA1UECwwLRW5naW5lZXJpbmcxEjAQ\nBgNVBAMMCUFSSy1HZW5vYTAeFw0yNDEyMzEwMDAwMDBaFw0zNDEyMzAwMDAwMDBa\nMHsxCzAJBgNVBAYTAlVTMQswCQYDVQQIDAJDQTEUMBIGA1UEBwwLU2FudGEgQ2xh\ncmExHzAdBgNVBAoMFkFkdmFuY2VkIE1pY3JvIERldmljZXMxFDASBgNVBAsMC0Vu\nZ2luZWVyaW5nMRIwEAYDVQQDDAlBUkstR2Vub2EwggIiMA0GCSqGSIb3DQEBAQUA\nA4ICDwAwggIKAoICAQDKmbKGiXoEtuQB+v1uie8k8czCshp0P+LCLu7OuSQeqDPq\naNujdeYtaJ1bIqGlSY9RcZ45ucsDy+a/CmCiIcDJJxBV+ZnOMi+8KeEXNYUTpgU7\n6FVUMPQvYM897NyKBE+wWVhoHBMFz5aUb9siOWjNxrj3wkISmy/m78DDNRRJ0hb3\nQP8hNx9Tb3t+UxmaRHx+i+lhsNGmX15bfQ9ZErcjMmIUpo2EkIEE5WTIP1sSJpd6\nLJAsww/pdJ8RSubg9bSM2LgAs0InnmUc44XjxByUoM4Gt1t7Oty5tq9d1Gxd9kFm\nI+9/EWMiKd+C9DfvKGkk+QYCmezvfKfLKtCbdH7Ff1E0N5t7oW2g09k/PgwCHrMi\nC8/R1mloyybdSJPCPKXIPv7GuXK2nS3achrkjw6Pf7JEpoQvtii2LJtG6bIgFDFX\nI+bNQg++ymznNkhFWoYO0+6fdPPY7GoMLtr1/qUDZTrgA+peyoNMSi5WUHSz0e9u\nB1XGqnzw2ezogGE+XogaCnBtrsFqBaPs60SQ6axWzhAa2BR7JyndN++79v+GVNtL\n6ZJgjrFWJpEL3O9m7WT0+v16wBU8jPekHJPgYP3K5wxE8i0oic2+wVOZ43l/BKxj\nDVkjiuCJX2RbhG6rhaA+BApDYreON7x4PQu7/mJ2U5tCh7/NtBYu2WAAgwEhIwID\nAQABo08wTTAPBgNVHRMBAf8EBTADAQH/MDoGA1UdHwQzMDEwL6AtoCuGKWh0dHBz\nOi8va2RzaW50Zi5hbWQuY29tL3ZjZWsvdjEvR2Vub2EvY3JsMEEGCSqGSIb3DQEB\nCjA0oA8wDQYJYIZIAWUDBAICBQChHDAaBgkqhkiG9w0BAQgwDQYJYIZIAWUDBAIC\nBQCiAwIBMAOCAgEAxe4P7PrmUc9EC66CpEkrVzqOWUPFQO4Mp/oAE2obWAxDu6fo\nKz0nU1oFPfai3RZS6H4nGUblVNDAiXDahK7tTIBQFQqzV+oWt2wQ/YIqq66R98kK\nsxWBk6zTKa1vQhbj/BsN8ItRZpANje7sMoI2vrdiQgS5IPvU/LA0XD0jekpcgGYo\npKHcVh3Er7aKE8r910co2Nn/gKYsN2+LBAFRh6QRkUSYMpOg8O6ORH6cmmMRNBuX\npGGrb91G3xuO+oDyjK2YJK/WE/VcjpsVTRCc4I3So6hMvQRfe+ZhW0MJv1XSTfQ2\nmlHOLd6dwZyiQ0tKd3EYGPJv54psYVMjxEScxBrd367N6kMexnEUgrssCE8LZxGx\nt+DPw3jozH+4MeQ37iJ8cWGYYS9D9DYQKd0eje5BHUYauud+6c307nzANcBz6z6Q\nDXlm7NAQjixGSbKO9mYO9V7oCMbT+DSZHNiaqny9Bfe9SEm/8E7G/vbh3XpZXSsu\nEfPdN2aWDb6mbITqS8NE+lVsbJ8jesnEJE7amq44HPBjxrgPhfK98QTW70Iv+Ek1\nVd61fDMAaXW2S1vMGPPzMavD6oGOdiA/I8vsgxXEY8ZQeXtHtrf2tQqMDRTSmoy4\nfDdWOjPtAiLyci1dfNCBh74DkOrXr31uowa1K54AEGtVu70hgS/fil7v8Uc=\n-----END CERTIFICATE-----\n",
    "ask_pem": "-----BEGIN CERTIFICATE-----\nMIIGKzCCA9+gAwIBAgIBAjBBBgkqhkiG9w0BAQowNKAPMA0GCWCGSAFlAwQCAgUA\noRwwGgYJKoZIhvcNAQEIMA0GCWCGSAFlAwQCAgUAogMCATAwezELMAkGA1UEBhMC\nVVMxCzAJBgNVBAgMAkNBMRQwEgYDVQQHDAtTYW50YSBDbGFyYTEfMB0GA1UECgwW\nQWR2YW5jZWQgTWljcm8gRGV2aWNlczEUMBIGA1UECwwLRW5naW5lZXJpbmcxEjAQ\nBgNVBAMMCUFSSy1HZW5vYTAeFw0yNDEyMzEwMDAwMDBaFw0zNDEyMzAwMDAwMDBa\nMHsxCzAJBgNVBAYTAlVTMQswCQYDVQQIDAJDQTEUMBIGA1UEBwwLU2FudGEgQ2xh\ncmExHzAdBgNVBAoMFkFkdmFuY2VkIE1pY3JvIERldmljZXMxFDASBgNVBAsMC0Vu\nZ2luZWVyaW5nMRIwEAYDVQQDDAlTRVYtR2Vub2EwggIiMA0GCSqGSIb3DQEBAQUA\nA4ICDwAwggIKAoICAQCexc9ejOLWXdhM6+AZ7whujE8Pns6gxy18ao/N53blTR+K\nD0CLsXzHxCR7GbutirD5EMcvBpbo/1Dl8cpVIK/2eL0/EhvkmAv0fARDsRDEZP85\nsd1C1ZVVaYHJ3zI5K9+nwjAivwr396kcPvUdn0WSRFFd12qk6mtW2QqVHQ1Doq1U\nnoPgNEx4XtRzylZA9oWdLWdTji9Woa3jfd0/gEzJc35Q1rVvvWH1lgIkmN/3LMP5\nF9AocRMRklcbPBGzQvzBpBpLkvVaDlROLd6BA95x6Bq94/gy0ddupGDziM5gUxRF\nme3CKFa0CS0X4D+7S2k6o8T7VVNZZvsGeuSXaxmOE0zNcWmHnYdtA1J21FAkaC7c\nhLnx0v56dATE55BjCDtsryYxOINA2/Spdl3dc5UpajYdzXg0aEknjkxNhc7RGCTP\ntEp+wWY/9jeDRwbv2ho7QizixMxR6IHPhX6Ro929fdbv6V1TeGWA95w202s9hwn/\ncxe9jhitIJA28ZFj5J9u8KDgdlZlxctbDaihTcWDeam0nucI0EZtSyiVHmNIxfhC\nPg4DN43nLZbAuvxkLLgyny5O9B3bpSStWuiZhERGrozdlDhvGhvC3bA0uWL2y/iu\ntZ65UMj24s4EI+Ct1+KF5in4JUMH727O7SjArqQCMg0wVvPFPZm5J6MSiAgNVwID\nAQABo1IwUDASBgNVHRMBAf8ECDAGAQH/AgEAMDoGA1UdHwQzMDEwL6AtoCuGKWh0\ndHBzOi8va2RzaW50Zi5hbWQuY29tL3ZjZWsvdjEvR2Vub2EvY3JsMEEGCSqGSIb3\nDQEBCjA0oA8wDQYJYIZIAWUDBAICBQChHDAaBgkqhkiG9w0BAQgwDQYJYIZIAWUD\nBAICBQCiAwIBMAOCAgEAH3L527xctVl5nDjfFBjW5CuN2FYaNbB2r46mD3DyknuT\nBA9yJ/ouRQ2TrRmYiU6E/Y3goDP31SQbq03HtiVo2NPStmlg3Hg1biwvSWNVDDtl\nM9g1qI2D5e+UtfHG6BVeHRynhsJS1WLzgIrwwaZJnQSQYpvB7BFQAFS4E+TC/jJQ\nNWEX7VFDrJ9o1+xqbCZiCfq9WSWxc9Yc3V4c9k+mrcORn9tKzS7dl/XnM9h4mECF\nj5FTJi9o0zYGyBXSkluerOxcgekec61ela4cDmQeWbzWX1z70Vqc4rdZGRKpeLaJ\nssdvGz2EAs+W94P7g3uCALzK6G+txZWadF0V02pMHQoIsjYOE+RWEhe8dVbrzqma\nTjRj3HMm1VXvxcj8OrFUxbNIg/bocJNkFK20ljwi5ojyEoPC9lVOeMkVGKl9FjEy\nVodETBE2EGxowGtDwnfjoCBBdusSWuFnNm9HsNo4vEIMxrMU8N2BeI8wtTrDNvdl\n6n6RAUu0W4ackUHoAVivK1yLF2w2U1aIIaUlsr/Q6aTbH8e6tuWRGfHI/zm0WUMK\nAqtzyAe3/75950TkpaAZ+/x+dHc84iRKd4XvWiwsg2VjJPnhUeDJlOq9ZnoqCM9c\nYEh4eOHw0SgVF++Iup3zLAB5HvE31q4/7BWvm0qtVQ+AJXJJ1dd7m+MJkFYVJ40=\n-----END CERTIFICATE-----\n"
  },
  "expected": {
    "accepted": false
  }
}
