{
  "id": "p7",
  "stage": "v3-authenticate-provenance",
  "input": {
    "schema_version": "1",
    "document_b64": "eyJmb3JtYXQiOiJodHRwczovL3RpbmZvaWwuc2gvcHJlZGljYXRlL2F0dGVzdGF0aW9uL3YzIiwiY2hhbGxlbmdlIjp7Im5vbmNlIjoiMDAwMTAyMDMwNDA1MDYwNzA4MDkwYTBiMGMwZDBlMGYxMDExMTIxMzE0MTUxNjE3MTgxOTFhMWIxYzFkMWUxZiIsInJlcG9ydF9kYXRhIjoiMGE1MzI2NmFlNWYxZGVkOWI3ZTlkZTQ3NjJkYWFiYTAzYTE2ZjI4ZmUyM2VlOTFkOTQ3MWQ2MDk4NWM1MjkxYjAwMDAwMDAwMDAwMDAwMDAwMDAwMDAwMDAwMDAwMDAwMDAwMDAwMDAwMDAwMDAwMDAwMDAwMDAwMDAwMDAwMDAiLCJyZXBvcnRfZGF0YV9hbGdvcml0aG0iOiJodHRwczovL3RpbmZvaWwuc2gvcmVwb3J0LWRhdGEvdjEifSwiY3B1X2V2aWRlbmNlIjp7ImZvcm1hdCI6Imh0dHBzOi8vdGluZm9pbC5zaC9mb3JtYXQvc2V2LXNucC1yZXBvcnQvdjEiLCJyZXBvcnRfYmFzZTY0IjoiQUFBQUFBQUFBQUFBQUFBQUFBQUFBQUFBQUFBQUFBQUFBQUFBQUFBQUFBQUFBQUFBQUFBQUFBQUFBQUFBQUFBQUFBQUFBQUFBQUFBQUFBQUFBQUFBQUFBQUFBQUFBQUFBQUFBQUFBQUFBQUFBQUFBQUFBQUFBQUFBQUFBQUFBQUFBQUFBQUFBQUFBQUFBQUFBQUFBQUFBQUFBQUFBQUFBQUFBQUFBQUFBQUFBQUFBQUFBQUFBQUFBQUFBQUFBQUFBQUFBQUFBQUFBQUFBQUFBQUFBQUFBQUFBQUFBQUFBQUFBQUFBQUFBQUFBQUFBQUFBQUFBQUFBQUFBQUFBQUFBQUFBQUFBQUFBQUFBQUFBQUFBQUFBQUFBQUFBQUFBQUFBQUFBQUFBQUFBQUFBQUFBQUFBQUFBQUFBQUFBQUFBQUFBQUFBQUFBQUFBQUFBQUFBQUFBQUFBQUFBQUFBQUFBQUFBQUFBQUFBQUFBQUFBQUFBQUFBQUFBQUFBQUFBQUFBQUFBQUFBQUFBQUFBQUFBQUFBQUFBQUFBQUFBQUFBQUFBQUFBQUFBQUFBQUFBQUFBQUFBQUFBQUFBQUFBQUFBQUFBQUFBQUFBQUFBQUFBQUFBQUFBQUFBQUFBQUFBQUFBQUFBQUFBQUFBQUFBQUFBQUFBQUFBQUFBQUFBQUFBQUFBQUFBQUFBQUFBQUFBQUFBQUFBQUFBQUFBQUFBQUFBQUFBQUFBQUFBQUFBQUFBQUFBQUFBQUFBQUFBQUFBQUFBQUFBQUFBQUFBQUFBQUFBQUFBQUFBQUFBQUFBQUFBQUFBQUFBQUFBQUFBQUFBQUFBQUFBQUFBQUFBQUFBQUFBQUFBQUFBQUFBQUFBQUFBQUFBQUFBQUFBQUFBQUFBQUFBQUFBQUFBQUFBQUFBQUFBQUFBQUFBQUFBQUFBQUFBQUFBQUFBQUFBQUFBQUFBQUFBQUFBQUFBQUFBQUFBQUFBQUFBQUFBQUFBQUFBQUFBQUFBQUFBQUFBQUFBQUFBQUFBQUFBQUFBQUFBQUFBQUFBQUFBQUFBQUFBQUFBQUFBQUFBQUFBQUFBQUFBQUFBQUFBQUFBQUFBQUFBQUFBQUFBQUFBQUFBQUFBQUFBQUFBQUFBQUFBQUFBQUFBQUFBQUFBQUFBQUFBQUFBQUFBQUFBQUFBQUFBQUFBQUFBQUFBQUFBQUFBQUFBQUFBQUFBQUFBQUFBQUFBQUFBQUFBQUFBQUFBQUFBQUFBQUFBQUFBQUFBQUFBQUFBQUFBQUFBQUFBQUFBQUFBQUFBQUFBQUFBQUFBQUFBQUFBQUFBQUFBQUFBQUFBQUFBQUFBQUFBQUFBQUFBQUFBQUFBQUFBQUFBQUFBQUFBQUFBQUFBQUFBQUFBQUFBQUFBQUFBQUFBQUFBQUFBQUFBQUFBQUFBQUFBQUFBQUFBQUFBQUFBQUFBQUFBQUFBQUFBQUFBQUFBQUFBQUFBQUFBQUFBQUFBQUFBQUFBQUFBQUFBQUFBQUFBQUFBQUFBQUFBQUFBQUFBQUFBQUFBQUFBQUFBQUFBQUFBQUFBQUFBQUFBQUFBQUFBQUFBQUFBQUFBQUFBQUFBQUFBQUFBQUFBQUFBQUFBQUFBQUFBQUFBQUFBQUFBQUFBQUFBQUFBQUFBQUFBQUFBQUFBQUFBQUFBQUFBQUFBQUFBQUFBQUFBQUFBQUFBQUFBQUFBQUFBQUFBQUFBQUFBQUFBQUFBQUFBQUFBQUFBQUFBQUFBQUFBQUFBQUFBQUFBQUFBQUFBQUFBQUFBQUFBQUFBQUFBQUFBQUFBQUFBQUFBQUFBQUFBQUFBQUFBQUFBQUFBQUFBQUFBQUFBQUFBQUFBQUFBQUFBQUFBQUFBQUFBQUFBQUFBQUFBQUFBQUFBQUFBQUFBQUFBQUFBQUFBQUFBQUFBQUFBQUFBQUFBQUFBQUFBQUFBQUFBQUFBQUFBQUFBQUFBQUFBQUFBQUFBQUFBQUFBQUFBQUFBQUFBQUFBQUFBQUFBQUFBQUFBQUFBQUFBQUFBQUFBQUFBQUFBQUFBQUFBQUFBQUFBQUFBQUFBQUFBQUFBQUFBQUFBQUFBQUFBQUFBQUFBQUFBQT0iLCJlbmRvcnNlZCI6eyJjcnlwdG9fbWF0ZXJpYWxfaGFzaCI6ImM4NDM4MmM2Y2E4OTg5YzkxOWFhZGFkNjk3OWE5MTdjMjQzZmMwNWRjYzU0MjUzNWY1ZjYxOGMzMWMwY2VmMTkiLCJkZXZpY2VfZXZpZGVuY2VfaGFzaCI6IjVlODRmNjMyZTAxMjkzYmZmNDU5NmNmNzJjNDVkZTBmOWUxMDM3ZTVjZGEzMjMyYjg1MGM0NzhkMWE2YjU5MmIifX0sImNyeXB0b19tYXRlcmlhbCI6ImV5Sm1iM0p0WVhRaU9pSm9kSFJ3Y3pvdkwzUnBibVp2YVd3dWMyZ3ZZM0o1Y0hSdkxXMWhkR1Z5YVdGc0wzWXhJaXdpYVhSbGJYTWlPbHRkZlE9PSIsImRldmljZV9ldmlkZW5jZSI6ImV5Sm1iM0p0WVhRaU9pSm9kSFJ3Y3pvdkwzUnBibVp2YVd3dWMyZ3ZaR1YyYVdObExXVjJhV1JsYm1ObEwzWXhJaXdpYVhSbGJYTWlPbHRkZlE9PSIsImNvbGxhdGVyYWwiOlt7ImlkIjoic2lnc3RvcmUtY29kZSIsInJvbGUiOiJyZWZlcmVuY2UtdmFsdWVzIiwiZm9ybWF0IjoiaHR0cHM6Ly90aW5mb2lsLnNoL2NvbGxhdGVyYWwvc2lnc3RvcmUtY29kZS92MSIsImRhdGEiOnsicmVwbyI6InRpbmZvaWxzaC9jb25maWRlbnRpYWwtaW5mZXJlbmNlLXByb3h5IiwidGFnIjoidjEuMC4wIiwiZGlnZXN0IjoiM2IyOTExN2JjYzk2YmIyODI4Nzk1MTRjYzAzYzMyZjNmN2ViOGE3YmQwMzFiODI5ZGQzODY0YzU5MWI4N2M1MCIsInNpZ3N0b3JlX2J1bmRsZSI6eyJtZWRpYVR5cGUiOiJhcHBsaWNhdGlvbi92bmQuZGV2LnNpZ3N0b3JlLmJ1bmRsZS52MC4zK2pzb24iLCJ2ZXJpZmljYXRpb25NYXRlcmlhbCI6eyJjZXJ0aWZpY2F0ZSI6eyJyYXdCeXRlcyI6Ik1JSUM4akNDQXBpZ0F3SUJBZ0lDRUFBd0NnWUlLb1pJemowRUF3SXdLakVvTUNZR0ExVUVBd3dmYzNsdWRHaGxkR2xqTFhOcFozTjBiM0psTFdsdWRHVnliV1ZrYVdGMFpUQWVGdzB5TkRFeU16RXlNelUxTURCYUZ3MHlOVEF4TURFd01ERXdNREJhTUFBd1dUQVRCZ2NxaGtqT1BRSUJCZ2dxaGtqT1BRTUJCd05DQUFSSUFCSDloZzZ1TUl6RUtSN3BkT3FrRGUxdW1lR2xITXBkSG1sUDI0VmErNzltUVR5VjA1bktpT1dNWWpnV2JjczhCL2JCZFFtdmp0RzR1eFhPU2tuOW80SUIxakNDQWRJd0RBWURWUjBUQVFIL0JBSXdBREFPQmdOVkhROEJBZjhFQkFNQ0I0QXdFd1lEVlIwbEJBd3dDZ1lJS3dZQkJRVUhBd013SFFZRFZSME9CQllFRk1oa1d6YU0rMElwNnF5UGIzSDNtcVdLWlFtak1COEdBMVVkSXdRWU1CYUFGR2NIemdZTjAxOU9jd2N4cnMxMXE0dHp0eTBaTURrR0Npc0dBUVFCZzc4d0FRRUVLMmgwZEhCek9pOHZkRzlyWlc0dVlXTjBhVzl1Y3k1bmFYUm9kV0oxYzJWeVkyOXVkR1Z1ZEM1amIyMHdIUVlLS3dZQkJBR0R2ekFCQ3dRUERBMW5hWFJvZFdJdGFHOXpkR1ZrTUhZR0ExVWRFUUVCL3dSc01HcUdhR2gwZEhCek9pOHZaMmwwYUhWaUxtTnZiUzkwYVc1bWIybHNjMmd2WTI5dVptbGtaVzUwYVdGc0xXbHVabVZ5Wlc1alpTMXdjbTk0ZVM4dVoybDBhSFZpTDNkdmNtdG1iRzkzY3k5eVpXeGxZWE5sTG5sdGJFQnlaV1p6TDNSaFozTXZkakV1TUM0d01JR0tCZ29yQmdFRUFkWjVBZ1FDQkh3RWVnQjRBSFlBUWtseEMrckpRaGVZcTBLRk5NSVFqelRIdytSZFVFVzNUNGtkWjFwa250d0FBQUdVSHlsOEFBQUFCQU1BUnpCRkFpQWR4RUZtMnNNdjNOS1lIRjhSUFJwYTNMVTcwMS9wdTNTV0JnaEcwYUJoZHdJaEFNdDA5Q1lIOGNlOE1SOUk3bXZEYWI1eEg0RmQvaC9CWkQyRVNXVXpIRkd0TUFvR0NDcUdTTTQ5QkFNQ0EwZ0FNRVVDSVFDWWRNRk43VG0zQWpEMjJHZUlxZmZVVWdzMnU0VlR0Z1FEUlJHUlo3U25JUUlnVTJuc0NORUYzamluS0xyUm5vOG9lMXMrbnNuRU1jUzduVk5GQXRucEkvTT0ifSwidGxvZ0VudHJpZXMiOltdfSwiZHNzZUVudmVsb3BlIjp7InBheWxvYWQiOiJleUpmZEhsd1pTSTZJbWgwZEhCek9pOHZhVzR0ZEc5MGJ5NXBieTlUZEdGMFpXMWxiblF2ZGpFaUxDSnpkV0pxWldOMElqcGJleUp1WVcxbElqb2lZMmx3SWl3aVpHbG5aWE4wSWpwN0luTm9ZVEkxTmlJNklqTmlNamt4TVRkaVkyTTVObUppTWpneU9EYzVOVEUwWTJNd00yTXpNbVl6WmpkbFlqaGhOMkprTURNeFlqZ3lPV1JrTXpnMk5HTTFPVEZpT0Rkak5UQWlmWDFkTENKd2NtVmthV05oZEdWVWVYQmxJam9pYUhSMGNITTZMeTkwYVc1bWIybHNMbk5vTDNCeVpXUnBZMkYwWlM5emJuQXRkR1I0TFcxMWJIUnBjR3hoZEdadmNtMHZkakVpTENKd2NtVmthV05oZEdVaU9uc2ljMjV3WDIxbFlYTjFjbVZ0Wlc1MElqb2lZV0ZoWVdGaFlXRmhZV0ZoWVdGaFlXRmhZV0ZoWVdGaFlXRmhZV0ZoWVdGaFlXRmhZV0ZoWVdGaFlXRmhZV0ZoWVdGaFlXRmhZV0ZoWVdGaFlXRmhZV0ZoWVdGaFlXRmhZV0ZoWVdGaFlXRmhZV0ZoWVdGaFlXRmhZV0ZoWVdGaElpd2lkR1I0WDIxbFlYTjFjbVZ0Wlc1MElqcDdJbkowYlhJeElqb2lZbUppWW1KaVltSmlZbUppWW1KaVltSmlZbUppWW1KaVltSmlZbUppWW1KaVltSmlZbUppWW1KaVltSmlZbUppWW1KaVltSmlZbUppWW1KaVltSmlZbUppWW1KaVltSmlZbUppWW1KaVltSmlZbUppWW1KaVltSmlZbUppWW1KaUlpd2ljblJ0Y2pJaU9pSmpZMk5qWTJOalkyTmpZMk5qWTJOalkyTmpZMk5qWTJOalkyTmpZMk5qWTJOalkyTmpZMk5qWTJOalkyTmpZMk5qWTJOalkyTmpZMk5qWTJOalkyTmpZMk5qWTJOalkyTmpZMk5qWTJOalkyTmpZMk5qWTJOalkyTmpZMk5qWTJNaWZTd2lkbTFmYzJoaGNHVWlPbnNpWTNCMWN5STZPQ3dpYldWdGIzSjVYMjFpSWpvek1qYzJPQ3dpWjNCMWN5STZNU3dpWkdsemEzTWlPako5ZlgwPSIsInBheWxvYWRUeXBlIjoiYXBwbGljYXRpb24vdm5kLmluLXRvdG8ranNvbiIsInNpZ25hdHVyZXMiOlt7InNpZyI6Ik1FUUNJQWR2R3c2RzhySFZWcmJ1Q01ydlNRZWpRMDY4NGRJNFBjYy90czhoKytxOEFpQTdTZndHOTdCYkxpaUxwRnMzblpwdUt1OGR4bWtzQ2h5OHJKMmdHNUM3Qmc9PSJ9XX19fX1dfQ==",
    "nonce_hex": "",
    "repo": "tinfoilsh/confidential-inference-proxy",
    "sigstore_trusted_root_json_b64": "eyJtZWRpYVR5cGUiOiAiYXBwbGljYXRpb24vdm5kLmRldi5zaWdzdG9yZS50cnVzdGVkcm9vdCtqc29uO3ZlcnNpb249MC4xIiwgImNlcnRpZmljYXRlQXV0aG9yaXRpZXMiOiBbeyJzdWJqZWN0IjogeyJvcmdhbml6YXRpb24iOiAic3ludGhldGljIiwgImNvbW1vbk5hbWUiOiAic3ludGhldGljLXNpZ3N0b3JlIn0sICJ1cmkiOiAiaHR0cHM6Ly9mdWxjaW8uc3ludGhldGljIiwgImNlcnRDaGFpbiI6IHsiY2VydGlmaWNhdGVzIjogW3sicmF3Qnl0ZXMiOiAiTUlJQm9UQ0NBVWVnQXdJQkFnSUJBakFLQmdncWhrak9QUVFEQWpBaU1TQXdIZ1lEVlFRRERCZHplVzUwYUdWMGFXTXRjMmxuYzNSdmNtVXRjbTl2ZERBZUZ3MHlOREV5TXpFd01EQXdNREJhRncwek5ERXlNekF3TURBd01EQmFNQ294S0RBbUJnTlZCQU1NSDNONWJuUm9aWFJwWXkxemFXZHpkRzl5WlMxcGJuUmxjbTFsWkdsaGRHVXdXVEFUQmdjcWhrak9QUUlCQmdncWhrak9QUU1CQndOQ0FBUmF5NEtOSGg2UGlPZ3UweitXSXgyaGxJMFI5L1JpbXdaV2FQSWQ4SGc1TW1Za3pyYks1eGVkaURCbldxR3RmK3VaS1crMHhKUEswS3p4UHdVNStrVVhvMll3WkRBU0JnTlZIUk1CQWY4RUNEQUdBUUgvQWdFQU1BNEdBMVVkRHdFQi93UUVBd0lCQmpBZEJnTlZIUTRFRmdRVVp3Zk9CZzNUWDA1ekJ6R3V6WFdyaTNPM0xSa3dId1lEVlIwakJCZ3dGb0FVMytiNkxTVVk3ZWFPUG9kY1hTUkoyOUhMQ3k0d0NnWUlLb1pJemowRUF3SURTQUF3UlFJaEFKenpqY2o1bHFjeHUveWVpaVhFbld2UXRlbkNML09UUkIvUGp6a0JYM09SQWlCUEgxRnFTNVBIMGNsZEpKN3NhN3dqZzluVGx0bjRkVkFoRWxONmFLRWZnZz09In0sIHsicmF3Qnl0ZXMiOiAiTUlJQmRqQ0NBUnVnQXdJQkFnSUJBVEFLQmdncWhrak9QUVFEQWpBaU1TQXdIZ1lEVlFRRERCZHplVzUwYUdWMGFXTXRjMmxuYzNSdmNtVXRjbTl2ZERBZUZ3MHlOREV5TXpFd01EQXdNREJhRncwek5ERXlNekF3TURBd01EQmFNQ0l4SURBZUJnTlZCQU1NRjNONWJuUm9aWFJwWXkxemFXZHpkRzl5WlMxeWIyOTBNRmt3RXdZSEtvWkl6ajBDQVFZSUtvWkl6ajBEQVFjRFFnQUU4U2d3SzhMNENPWjVGM003M2xOOXZZQi9aQ0l4UnR0Uk5UTW9keXlsdWNqY0c0M0xYR0t0cG96Z3BqbWtUVENiQVNlZkt3T295MGJ0R1BET0dtdktFYU5DTUVBd0R3WURWUjBUQVFIL0JBVXdBd0VCL3pBT0JnTlZIUThCQWY4RUJBTUNBUVl3SFFZRFZSME9CQllFRk4vbStpMGxHTzNtamo2SFhGMGtTZHZSeXdzdU1Bb0dDQ3FHU000OUJBTUNBMGtBTUVZQ0lRRFlMNWIvT2l0L2l1bEx3QzQxT1BJOGNYU2M4Z1ZkMjlHVUFxTHRJVE1kUFFJaEFQMzZCcm03SkQwSFg0SDl4bkg1MWU4Nzl5L0pWTjNiTVJlSnZzUktWTUJ5In1dfSwgInZhbGlkRm9yIjogeyJzdGFydCI6ICIyMDI0LTEyLTMxVDAwOjAwOjAwWiJ9fV0sICJjdGxvZ3MiOiBbeyJiYXNlVXJsIjogImh0dHBzOi8vY3Rsb2cuc3ludGhldGljIiwgImhhc2hBbGdvcml0aG0iOiAiU0hBMl8yNTYiLCAicHVibGljS2V5IjogeyJyYXdCeXRlcyI6ICJNRmt3RXdZSEtvWkl6ajBDQVFZSUtvWkl6ajBEQVFjRFFnQUVabCs0cTBmSTNrcThiNk1maUpOOW1WbjRiak9XcFhuYjRheW1Dd2E5Z3phdHljMGM3bWd4eDF3Q2FaeW9tR0Qzckt4cC85QUR4SmJJYU9LNjdVa1REZz09IiwgImtleURldGFpbHMiOiAiUEtJWF9FQ0RTQV9QMjU2X1NIQV8yNTYiLCAidmFsaWRGb3IiOiB7InN0YXJ0IjogIjIwMjQtMTItMzFUMDA6MDA6MDBaIn19LCAibG9nSWQiOiB7ImtleUlkIjogIlFrbHhDK3JKUWhlWXEwS0ZOTUlRanpUSHcrUmRVRVczVDRrZFoxcGtudHc9In19XSwgInRsb2dzIjogW3siYmFzZVVybCI6ICJodHRwczovL3Jla29yLnN5bnRoZXRpYyIsICJoYXNoQWxnb3JpdGhtIjogIlNIQTJfMjU2IiwgInB1YmxpY0tleSI6IHsicmF3Qnl0ZXMiOiAiTUZrd0V3WUhLb1pJemowQ0FRWUlLb1pJemowREFRY0RRZ0FFcmk5WVhpUzNkWERqSEpFSUxqeHo5QU5mSCtTeWwwUkxHaHVVYVpabzZRODJJb1FQcHA1eVhUb3I1aGFLWjNtdWcwczgrUytHWTNEd2RUQmdRWWdCclE9PSIsICJrZXlEZXRhaWxzIjogIlBLSVhfRUNEU0FfUDI1Nl9TSEFfMjU2IiwgInZhbGlkRm9yIjogeyJzdGFydCI6ICIyMDI0LTEyLTMxVDAwOjAwOjAwWiJ9fSwgImxvZ0lkIjogeyJrZXlJZCI6ICJuMHFOck1wMzBORTdHOTJJT293UWNXQURMUEVsVzM0dHlDdGwrcUxCbnlnPSJ9fV0sICJ0aW1lc3RhbXBBdXRob3JpdGllcyI6IFtdfQ=="
  },
  "expected": {
    "accepted": false
  }
}
