{
  "id": "e8",
  "stage": "v3-check-envelope",
  "input": {
    "schema_version": "1",
    "document_b64": "eyJmb3JtYXQiOiJodHRwczovL3RpbmZvaWwuc2gvcHJlZGljYXRlL2F0dGVzdGF0aW9uL3YzIiwiY2hhbGxlbmdlIjp7Im5vbmNlIjoiMDAwMTAyMDMwNDA1MDYwNzA4MDkwYTBiMGMwZDBlMGYxMDExMTIxMzE0MTUxNjE3MTgxOTFhMWIxYzFkMWUxZiIsInJlcG9ydF9kYXRhIjoiYjhhM2RjZGI5OWNkODFiYjM3ODhjMWRjNzZjODllYmE1N2RlOGYyMDY0MTA2ZmE2NTQyNDRkMGMzNTI0NDk3MTAwMDAwMDAwMDAwMDAwMDAwMDAwMDAwMDAwMDAwMDAwMDAwMDAwMDAwMDAwMDAwMDAwMDAwMDAwMDAwMDAwMDAiLCJyZXBvcnRfZGF0YV9hbGdvcml0aG0iOiJodHRwczovL3RpbmZvaWwuc2gvcmVwb3J0LWRhdGEvdjEteCJ9LCJjcHVfZXZpZGVuY2UiOnsiZm9ybWF0IjoiaHR0cHM6Ly90aW5mb2lsLnNoL2Zvcm1hdC9zZXYtc25wLXJlcG9ydC92MSIsInJlcG9ydF9iYXNlNjQiOiJBQUFBQUFBQUFBQUFBQUFBQUFBQUFBQUFBQUFBQUFBQUFBQUFBQUFBQUFBQUFBQUFBQUFBQUFBQUFBQUFBQUFBQUFBQUFBQUFBQUFBQUFBQUFBQUFBQUFBQUFBQUFBQUFBQUFBQUFBQUFBQUFBQUFBQUFBQUFBQUFBQUFBQUFBQUFBQUFBQUFBQUFBQUFBQUFBQUFBQUFBQUFBQUFBQUFBQUFBQUFBQUFBQUFBQUFBQUFBQUFBQUFBQUFBQUFBQUFBQUFBQUFBQUFBQUFBQUFBQUFBQUFBQUFBQUFBQUFBQUFBQUFBQUFBQUFBQUFBQUFBQUFBQUFBQUFBQUFBQUFBQUFBQUFBQUFBQUFBQUFBQUFBQUFBQUFBQUFBQUFBQUFBQUFBQUFBQUFBQUFBQUFBQUFBQUFBQUFBQUFBQUFBQUFBQUFBQUFBQUFBQUFBQUFBQUFBQUFBQUFBQUFBQUFBQUFBQUFBQUFBQUFBQUFBQUFBQUFBQUFBQUFBQUFBQUFBQUFBQUFBQUFBQUFBQUFBQUFBQUFBQUFBQUFBQUFBQUFBQUFBQUFBQUFBQUFBQUFBQUFBQUFBQUFBQUFBQUFBQUFBQUFBQUFBQUFBQUFBQUFBQUFBQUFBQUFBQUFBQUFBQUFBQUFBQUFBQUFBQUFBQUFBQUFBQUFBQUFBQUFBQUFBQUFBQUFBQUFBQUFBQUFBQUFBQUFBQUFBQUFBQUFBQUFBQUFBQUFBQUFBQUFBQUFBQUFBQUFBQUFBQUFBQUFBQUFBQUFBQUFBQUFBQUFBQUFBQUFBQUFBQUFBQUFBQUFBQUFBQUFBQUFBQUFBQUFBQUFBQUFBQUFBQUFBQUFBQUFBQUFBQUFBQUFBQUFBQUFBQUFBQUFBQUFBQUFBQUFBQUFBQUFBQUFBQUFBQUFBQUFBQUFBQUFBQUFBQUFBQUFBQUFBQUFBQUFBQUFBQUFBQUFBQUFBQUFBQUFBQUFBQUFBQUFBQUFBQUFBQUFBQUFBQUFBQUFBQUFBQUFBQUFBQUFBQUFBQUFBQUFBQUFBQUFBQUFBQUFBQUFBQUFBQUFBQUFBQUFBQUFBQUFBQUFBQUFBQUFBQUFBQUFBQUFBQUFBQUFBQUFBQUFBQUFBQUFBQUFBQUFBQUFBQUFBQUFBQUFBQUFBQUFBQUFBQUFBQUFBQUFBQUFBQUFBQUFBQUFBQUFBQUFBQUFBQUFBQUFBQUFBQUFBQUFBQUFBQUFBQUFBQUFBQUFBQUFBQUFBQUFBQUFBQUFBQUFBQUFBQUFBQUFBQUFBQUFBQUFBQUFBQUFBQUFBQUFBQUFBQUFBQUFBQUFBQUFBQUFBQUFBQUFBQUFBQUFBQUFBQUFBQUFBQUFBQUFBQUFBQUFBQUFBQUFBQUFBQUFBQUFBQUFBQUFBQUFBQUFBQUFBQUFBQUFBQUFBQUFBQUFBQUFBQUFBQUFBQUFBQUFBQUFBQUFBQUFBQUFBQUFBQUFBQUFBQUFBQUFBQUFBQUFBQUFBQUFBQUFBQUFBQUFBQUFBQUFBQUFBQUFBQUFBQUFBQUFBQUFBQUFBQUFBQUFBQUFBQUFBQUFBQUFBQUFBQUFBQUFBQUFBQUFBQUFBQUFBQUFBQUFBQUFBQUFBQUFBQUFBQUFBQUFBQUFBQUFBQUFBQUFBQUFBQUFBQUFBQUFBQUFBQUFBQUFBQUFBQUFBQUFBQUFBQUFBQUFBQUFBQUFBQUFBQUFBQUFBQUFBQUFBQUFBQUFBQUFBQUFBQUFBQUFBQUFBQUFBQUFBQUFBQUFBQUFBQUFBQUFBQUFBQUFBQUFBQUFBQUFBQUFBQUFBQUFBQUFBQUFBQUFBQUFBQUFBQUFBQUFBQUFBQUFBQUFBQUFBQUFBQUFBQUFBQUFBQUFBQUFBQUFBQUFBQUFBQUFBQUFBQUFBQUFBQUFBQUFBQUFBQUFBQUFBQUFBQUFBQUFBQUFBQUFBQUFBQUFBQUFBQUFBQUFBQUFBQUFBQUFBQUFBQUFBQUFBQUFBQUFBQUFBQUFBQUFBQUFBQUFBQUFBQUFBQUFBQUFBQUFBQUFBQUFBQUFBQUFBQUFBQUFBQUFBQUFBQUFBQUFBQUFBQUFBPSIsImVuZG9yc2VkIjp7ImNyeXB0b19tYXRlcmlhbF9oYXNoIjoiZWYwYTFlMGU0NTk2NmQ2ZDE4MjEyODhkNjBkZGE5MTBjNDg0ZjJlYmIxMWEwM2YxOTZlNjljMzEzMjY4OGFhMiIsImRldmljZV9ldmlkZW5jZV9oYXNoIjoiNWU4NGY2MzJlMDEyOTNiZmY0NTk2Y2Y3MmM0NWRlMGY5ZTEwMzdlNWNkYTMyMzJiODUwYzQ3OGQxYTZiNTkyYiJ9fSwiY3J5cHRvX21hdGVyaWFsIjoiZXlKbWIzSnRZWFFpT2lKb2RIUndjem92TDNScGJtWnZhV3d1YzJndlkzSjVjSFJ2TFcxaGRHVnlhV0ZzTDNZeElpd2lhWFJsYlhNaU9sdDdJbWxrSWpvaWRHeHpJaXdpWm05eWJXRjBJam9pYUhSMGNITTZMeTkwYVc1bWIybHNMbk5vTDJ0bGVTOXpjR3RwTFdad0xYTm9ZVEkxTmk5Mk1TSXNJbVJoZEdFaU9pSmtNV0V6TnpnNE9UTXdOelV3TVRnMFpqSm1aVEkyT0dFeU1qSmlOV00yTldKaFlqazNOREEyT1RVM00yTTBZV1ppWmpZMU5qUTFOR1l3TmpaaU5tVXpJbjBzZXlKcFpDSTZJbWh3YTJVaUxDSm1iM0p0WVhRaU9pSm9kSFJ3Y3pvdkwzUnBibVp2YVd3dWMyZ3ZhMlY1TDNneU5UVXhPUzFvY0d0bEwzWXhJaXdpWkdGMFlTSTZJalU0WXpsaU16YzFObVEzTXpnME5qWmhZMlV4WlRJM1pqZ3pZVGRtWlRJeFlqTXpOVFpsWXpNMk1qWTVOR0ZsWmpFMU1EWmpOV1l6TldNM05qWmhNREVpZlYxOSIsImRldmljZV9ldmlkZW5jZSI6ImV5Sm1iM0p0WVhRaU9pSm9kSFJ3Y3pvdkwzUnBibVp2YVd3dWMyZ3ZaR1YyYVdObExXVjJhV1JsYm1ObEwzWXhJaXdpYVhSbGJYTWlPbHRkZlE9PSIsImNvbGxhdGVyYWwiOltdfQ==",
    "nonce_hex": "000102030405060708090a0b0c0d0e0f101112131415161718191a1b1c1d1e1f",
    "repo": "tinfoilsh/confidential-inference-proxy"
  },
  "expected": {
    "accepted": false,
    "code": "ENVELOPE_REJECTED"
  }
}
