{
  "id": "p1",
  "stage": "v3-authenticate-provenance",
  "input": {
    "schema_version": "1",
    "document_b64": "eyJmb3JtYXQiOiJodHRwczovL3RpbmZvaWwuc2gvcHJlZGljYXRlL2F0dGVzdGF0aW9uL3YzIiwiY2hhbGxlbmdlIjp7Im5vbmNlIjoiMDAwMTAyMDMwNDA1MDYwNzA4MDkwYTBiMGMwZDBlMGYxMDExMTIxMzE0MTUxNjE3MTgxOTFhMWIxYzFkMWUxZiIsInJlcG9ydF9kYXRhIjoiMGE1MzI2NmFlNWYxZGVkOWI3ZTlkZTQ3NjJkYWFiYTAzYTE2ZjI4ZmUyM2VlOTFkOTQ3MWQ2MDk4NWM1MjkxYjAwMDAwMDAwMDAwMDAwMDAwMDAwMDAwMDAwMDAwMDAwMDAwMDAwMDAwMDAwMDAwMDAwMDAwMDAwMDAwMDAwMDAiLCJyZXBvcnRfZGF0YV9hbGdvcml0aG0iOiJodHRwczovL3RpbmZvaWwuc2gvcmVwb3J0LWRhdGEvdjEifSwiY3B1X2V2aWRlbmNlIjp7ImZvcm1hdCI6Imh0dHBzOi8vdGluZm9pbC5zaC9mb3JtYXQvc2V2LXNucC1yZXBvcnQvdjEiLCJyZXBvcnRfYmFzZTY0IjoiQUFBQUFBQUFBQUFBQUFBQUFBQUFBQUFBQUFBQUFBQUFBQUFBQUFBQUFBQUFBQUFBQUFBQUFBQUFBQUFBQUFBQUFBQUFBQUFBQUFBQUFBQUFBQUFBQUFBQUFBQUFBQUFBQUFBQUFBQUFBQUFBQUFBQUFBQUFBQUFBQUFBQUFBQUFBQUFBQUFBQUFBQUFBQUFBQUFBQUFBQUFBQUFBQUFBQUFBQUFBQUFBQUFBQUFBQUFBQUFBQUFBQUFBQUFBQUFBQUFBQUFBQUFBQUFBQUFBQUFBQUFBQUFBQUFBQUFBQUFBQUFBQUFBQUFBQUFBQUFBQUFBQUFBQUFBQUFBQUFBQUFBQUFBQUFBQUFBQUFBQUFBQUFBQUFBQUFBQUFBQUFBQUFBQUFBQUFBQUFBQUFBQUFBQUFBQUFBQUFBQUFBQUFBQUFBQUFBQUFBQUFBQUFBQUFBQUFBQUFBQUFBQUFBQUFBQUFBQUFBQUFBQUFBQUFBQUFBQUFBQUFBQUFBQUFBQUFBQUFBQUFBQUFBQUFBQUFBQUFBQUFBQUFBQUFBQUFBQUFBQUFBQUFBQUFBQUFBQUFBQUFBQUFBQUFBQUFBQUFBQUFBQUFBQUFBQUFBQUFBQUFBQUFBQUFBQUFBQUFBQUFBQUFBQUFBQUFBQUFBQUFBQUFBQUFBQUFBQUFBQUFBQUFBQUFBQUFBQUFBQUFBQUFBQUFBQUFBQUFBQUFBQUFBQUFBQUFBQUFBQUFBQUFBQUFBQUFBQUFBQUFBQUFBQUFBQUFBQUFBQUFBQUFBQUFBQUFBQUFBQUFBQUFBQUFBQUFBQUFBQUFBQUFBQUFBQUFBQUFBQUFBQUFBQUFBQUFBQUFBQUFBQUFBQUFBQUFBQUFBQUFBQUFBQUFBQUFBQUFBQUFBQUFBQUFBQUFBQUFBQUFBQUFBQUFBQUFBQUFBQUFBQUFBQUFBQUFBQUFBQUFBQUFBQUFBQUFBQUFBQUFBQUFBQUFBQUFBQUFBQUFBQUFBQUFBQUFBQUFBQUFBQUFBQUFBQUFBQUFBQUFBQUFBQUFBQUFBQUFBQUFBQUFBQUFBQUFBQUFBQUFBQUFBQUFBQUFBQUFBQUFBQUFBQUFBQUFBQUFBQUFBQUFBQUFBQUFBQUFBQUFBQUFBQUFBQUFBQUFBQUFBQUFBQUFBQUFBQUFBQUFBQUFBQUFBQUFBQUFBQUFBQUFBQUFBQUFBQUFBQUFBQUFBQUFBQUFBQUFBQUFBQUFBQUFBQUFBQUFBQUFBQUFBQUFBQUFBQUFBQUFBQUFBQUFBQUFBQUFBQUFBQUFBQUFBQUFBQUFBQUFBQUFBQUFBQUFBQUFBQUFBQUFBQUFBQUFBQUFBQUFBQUFBQUFBQUFBQUFBQUFBQUFBQUFBQUFBQUFBQUFBQUFBQUFBQUFBQUFBQUFBQUFBQUFBQUFBQUFBQUFBQUFBQUFBQUFBQUFBQUFBQUFBQUFBQUFBQUFBQUFBQUFBQUFBQUFBQUFBQUFBQUFBQUFBQUFBQUFBQUFBQUFBQUFBQUFBQUFBQUFBQUFBQUFBQUFBQUFBQUFBQUFBQUFBQUFBQUFBQUFBQUFBQUFBQUFBQUFBQUFBQUFBQUFBQUFBQUFBQUFBQUFBQUFBQUFBQUFBQUFBQUFBQUFBQUFBQUFBQUFBQUFBQUFBQUFBQUFBQUFBQUFBQUFBQUFBQUFBQUFBQUFBQUFBQUFBQUFBQUFBQUFBQUFBQUFBQUFBQUFBQUFBQUFBQUFBQUFBQUFBQUFBQUFBQUFBQUFBQUFBQUFBQUFBQUFBQUFBQUFBQUFBQUFBQUFBQUFBQUFBQUFBQUFBQUFBQUFBQUFBQUFBQUFBQUFBQUFBQUFBQUFBQUFBQUFBQUFBQUFBQUFBQUFBQUFBQUFBQUFBQUFBQUFBQUFBQUFBQUFBQUFBQUFBQUFBQUFBQUFBQUFBQUFBQUFBQUFBQUFBQUFBQUFBQUFBQUFBQUFBQUFBQUFBQUFBQUFBQUFBQUFBQUFBQUFBQUFBQUFBQUFBQUFBQUFBQUFBQUFBQUFBQUFBQUFBQUFBQUFBQUFBQUFBQUFBQUFBQUFBQUFBQUFBQUFBQUFBQUFBQT0iLCJlbmRvcnNlZCI6eyJjcnlwdG9fbWF0ZXJpYWxfaGFzaCI6ImM4NDM4MmM2Y2E4OTg5YzkxOWFhZGFkNjk3OWE5MTdjMjQzZmMwNWRjYzU0MjUzNWY1ZjYxOGMzMWMwY2VmMTkiLCJkZXZpY2VfZXZpZGVuY2VfaGFzaCI6IjVlODRmNjMyZTAxMjkzYmZmNDU5NmNmNzJjNDVkZTBmOWUxMDM3ZTVjZGEzMjMyYjg1MGM0NzhkMWE2YjU5MmIifX0sImNyeXB0b19tYXRlcmlhbCI6ImV5Sm1iM0p0WVhRaU9pSm9kSFJ3Y3pvdkwzUnBibVp2YVd3dWMyZ3ZZM0o1Y0hSdkxXMWhkR1Z5YVdGc0wzWXhJaXdpYVhSbGJYTWlPbHRkZlE9PSIsImRldmljZV9ldmlkZW5jZSI6ImV5Sm1iM0p0WVhRaU9pSm9kSFJ3Y3pvdkwzUnBibVp2YVd3dWMyZ3ZaR1YyYVdObExXVjJhV1JsYm1ObEwzWXhJaXdpYVhSbGJYTWlPbHRkZlE9PSIsImNvbGxhdGVyYWwiOltdfQ==",
    "nonce_hex": "",
    "repo": "tinfoilsh/confidential-inference-proxy",
    "sigstore_trusted_root_json_b64": "eyJtZWRpYVR5cGUiOiAiYXBwbGljYXRpb24vdm5kLmRldi5zaWdzdG9yZS50cnVzdGVkcm9vdCtqc29uO3ZlcnNpb249MC4xIiwgImNlcnRpZmljYXRlQXV0aG9yaXRpZXMiOiBbeyJzdWJqZWN0IjogeyJvcmdhbml6YXRpb24iOiAic3ludGhldGljIiwgImNvbW1vbk5hbWUiOiAic3ludGhldGljLXNpZ3N0b3JlIn0sICJ1cmkiOiAiaHR0cHM6Ly9mdWxjaW8uc3ludGhldGljIiwgImNlcnRDaGFpbiI6IHsiY2VydGlmaWNhdGVzIjogW3sicmF3Qnl0ZXMiOiAiTUlJQm9EQ0NBVWVnQXdJQkFnSUJBakFLQmdncWhrak9QUVFEQWpBaU1TQXdIZ1lEVlFRRERCZHplVzUwYUdWMGFXTXRjMmxuYzNSdmNtVXRjbTl2ZERBZUZ3MHlOREV5TXpFd01EQXdNREJhRncwek5ERXlNekF3TURBd01EQmFNQ294S0RBbUJnTlZCQU1NSDNONWJuUm9aWFJwWXkxemFXZHpkRzl5WlMxcGJuUmxjbTFsWkdsaGRHVXdXVEFUQmdjcWhrak9QUUlCQmdncWhrak9QUU1CQndOQ0FBUmF5NEtOSGg2UGlPZ3UweitXSXgyaGxJMFI5L1JpbXdaV2FQSWQ4SGc1TW1Za3pyYks1eGVkaURCbldxR3RmK3VaS1crMHhKUEswS3p4UHdVNStrVVhvMll3WkRBU0JnTlZIUk1CQWY4RUNEQUdBUUgvQWdFQU1BNEdBMVVkRHdFQi93UUVBd0lCQmpBZEJnTlZIUTRFRmdRVVp3Zk9CZzNUWDA1ekJ6R3V6WFdyaTNPM0xSa3dId1lEVlIwakJCZ3dGb0FVMytiNkxTVVk3ZWFPUG9kY1hTUkoyOUhMQ3k0d0NnWUlLb1pJemowRUF3SURSd0F3UkFJZ1BVUzlkbFpZQjVsLzhucHVVZXpyazJuc2k3clhwbzQ0cFRxVzBlTG5rQ1FDSUhud2VYVEpSOTBpRHlvNUFoMm9WRkFvZzhMM0pUQVBpZVg5Y1loUUVxUFgifSwgeyJyYXdCeXRlcyI6ICJNSUlCZGpDQ0FSdWdBd0lCQWdJQkFUQUtCZ2dxaGtqT1BRUURBakFpTVNBd0hnWURWUVFEREJkemVXNTBhR1YwYVdNdGMybG5jM1J2Y21VdGNtOXZkREFlRncweU5ERXlNekV3TURBd01EQmFGdzB6TkRFeU16QXdNREF3TURCYU1DSXhJREFlQmdOVkJBTU1GM041Ym5Sb1pYUnBZeTF6YVdkemRHOXlaUzF5YjI5ME1Ga3dFd1lIS29aSXpqMENBUVlJS29aSXpqMERBUWNEUWdBRThTZ3dLOEw0Q09aNUYzTTczbE45dllCL1pDSXhSdHRSTlRNb2R5eWx1Y2pjRzQzTFhHS3Rwb3pncGpta1RUQ2JBU2VmS3dPb3kwYnRHUERPR212S0VhTkNNRUF3RHdZRFZSMFRBUUgvQkFVd0F3RUIvekFPQmdOVkhROEJBZjhFQkFNQ0FRWXdIUVlEVlIwT0JCWUVGTi9tK2kwbEdPM21qajZIWEYwa1NkdlJ5d3N1TUFvR0NDcUdTTTQ5QkFNQ0Ewa0FNRVlDSVFDcEdEY20zZnVWYkRFZWsya1NJZHkySnBPbWtzYXh1bWdsVE5kU0hsWEVPd0loQVBoNUowU2FYVkVCQUxVMnRmT1cxV3NSRCtJVGV3NDVmNmFBcVVQSExSeUgifV19LCAidmFsaWRGb3IiOiB7InN0YXJ0IjogIjIwMjQtMTItMzFUMDA6MDA6MDBaIn19XSwgImN0bG9ncyI6IFt7ImJhc2VVcmwiOiAiaHR0cHM6Ly9jdGxvZy5zeW50aGV0aWMiLCAiaGFzaEFsZ29yaXRobSI6ICJTSEEyXzI1NiIsICJwdWJsaWNLZXkiOiB7InJhd0J5dGVzIjogIk1Ga3dFd1lIS29aSXpqMENBUVlJS29aSXpqMERBUWNEUWdBRVpsKzRxMGZJM2txOGI2TWZpSk45bVZuNGJqT1dwWG5iNGF5bUN3YTlnemF0eWMwYzdtZ3h4MXdDYVp5b21HRDNyS3hwLzlBRHhKYklhT0s2N1VrVERnPT0iLCAia2V5RGV0YWlscyI6ICJQS0lYX0VDRFNBX1AyNTZfU0hBXzI1NiIsICJ2YWxpZEZvciI6IHsic3RhcnQiOiAiMjAyNC0xMi0zMVQwMDowMDowMFoifX0sICJsb2dJZCI6IHsia2V5SWQiOiAiUWtseEMrckpRaGVZcTBLRk5NSVFqelRIdytSZFVFVzNUNGtkWjFwa250dz0ifX1dLCAidGxvZ3MiOiBbeyJiYXNlVXJsIjogImh0dHBzOi8vcmVrb3Iuc3ludGhldGljIiwgImhhc2hBbGdvcml0aG0iOiAiU0hBMl8yNTYiLCAicHVibGljS2V5IjogeyJyYXdCeXRlcyI6ICJNRmt3RXdZSEtvWkl6ajBDQVFZSUtvWkl6ajBEQVFjRFFnQUVyaTlZWGlTM2RYRGpISkVJTGp4ejlBTmZIK1N5bDBSTEdodVVhWlpvNlE4MklvUVBwcDV5WFRvcjVoYUtaM211ZzBzOCtTK0dZM0R3ZFRCZ1FZZ0JyUT09IiwgImtleURldGFpbHMiOiAiUEtJWF9FQ0RTQV9QMjU2X1NIQV8yNTYiLCAidmFsaWRGb3IiOiB7InN0YXJ0IjogIjIwMjQtMTItMzFUMDA6MDA6MDBaIn19LCAibG9nSWQiOiB7ImtleUlkIjogIm4wcU5yTXAzME5FN0c5MklPb3dRY1dBRExQRWxXMzR0eUN0bCtxTEJueWc9In19XSwgInRpbWVzdGFtcEF1dGhvcml0aWVzIjogW119"
  },
  "expected": {
    "accepted": false,
    "code": "PROVENANCE_REJECTED"
  }
}
