{
  "id": "e17",
  "stage": "v3-check-envelope",
  "input": {
    "schema_version": "1",
    "document_b64": "eyJmb3JtYXQiOiJodHRwczovL3RpbmZvaWwuc2gvcHJlZGljYXRlL2F0dGVzdGF0aW9uL3YzIiwiY2hhbGxlbmdlIjp7Im5vbmNlIjoiMDAwMTAyMDMwNDA1MDYwNzA4MDkwYTBiMGMwZDBlMGYxMDExMTIxMzE0MTUxNjE3MTgxOTFhMWIxYzFkMWUxZiIsInJlcG9ydF9kYXRhIjoiY2NjY2NjY2NjY2NjY2NjY2NjY2NjY2NjY2NjY2NjY2NjY2NjY2NjY2NjY2NjY2NjY2NjY2NjY2NjY2NjY2NjY2NjY2NjY2NjY2NjY2NjY2NjY2NjY2NjY2NjY2NjY2NjY2NjY2NjY2NjY2NjY2NjY2NjY2NjY2NjY2NjY2NjY2MiLCJyZXBvcnRfZGF0YV9hbGdvcml0aG0iOiJodHRwczovL3RpbmZvaWwuc2gvcmVwb3J0LWRhdGEvdjEifSwiY3B1X2V2aWRlbmNlIjp7ImZvcm1hdCI6Imh0dHBzOi8vdGluZm9pbC5zaC9mb3JtYXQvc2V2LXNucC1yZXBvcnQvdjEiLCJyZXBvcnRfYmFzZTY0IjoiQUFBQUFBQUFBQUFBQUFBQUFBQUFBQUFBQUFBQUFBQUFBQUFBQUFBQUFBQUFBQUFBQUFBQUFBQUFBQUFBQUFBQUFBQUFBQUFBQUFBQUFBQUFBQUFBQUFBQUFBQUFBQUFBQUFBQUFBQUFBQUFBQUFBQUFBQUFBQUFBQUFBQUFBQUFBQUFBQUFBQUFBQUFBQUFBQUFBQUFBQUFBQUFBQUFBQUFBQUFBQUFBQUFBQUFBQUFBQUFBQUFBQUFBQUFBQUFBQUFBQUFBQUFBQUFBQUFBQUFBQUFBQUFBQUFBQUFBQUFBQUFBQUFBQUFBQUFBQUFBQUFBQUFBQUFBQUFBQUFBQUFBQUFBQUFBQUFBQUFBQUFBQUFBQUFBQUFBQUFBQUFBQUFBQUFBQUFBQUFBQUFBQUFBQUFBQUFBQUFBQUFBQUFBQUFBQUFBQUFBQUFBQUFBQUFBQUFBQUFBQUFBQUFBQUFBQUFBQUFBQUFBQUFBQUFBQUFBQUFBQUFBQUFBQUFBQUFBQUFBQUFBQUFBQUFBQUFBQUFBQUFBQUFBQUFBQUFBQUFBQUFBQUFBQUFBQUFBQUFBQUFBQUFBQUFBQUFBQUFBQUFBQUFBQUFBQUFBQUFBQUFBQUFBQUFBQUFBQUFBQUFBQUFBQUFBQUFBQUFBQUFBQUFBQUFBQUFBQUFBQUFBQUFBQUFBQUFBQUFBQUFBQUFBQUFBQUFBQUFBQUFBQUFBQUFBQUFBQUFBQUFBQUFBQUFBQUFBQUFBQUFBQUFBQUFBQUFBQUFBQUFBQUFBQUFBQUFBQUFBQUFBQUFBQUFBQUFBQUFBQUFBQUFBQUFBQUFBQUFBQUFBQUFBQUFBQUFBQUFBQUFBQUFBQUFBQUFBQUFBQUFBQUFBQUFBQUFBQUFBQUFBQUFBQUFBQUFBQUFBQUFBQUFBQUFBQUFBQUFBQUFBQUFBQUFBQUFBQUFBQUFBQUFBQUFBQUFBQUFBQUFBQUFBQUFBQUFBQUFBQUFBQUFBQUFBQUFBQUFBQUFBQUFBQUFBQUFBQUFBQUFBQUFBQUFBQUFBQUFBQUFBQUFBQUFBQUFBQUFBQUFBQUFBQUFBQUFBQUFBQUFBQUFBQUFBQUFBQUFBQUFBQUFBQUFBQUFBQUFBQUFBQUFBQUFBQUFBQUFBQUFBQUFBQUFBQUFBQUFBQUFBQUFBQUFBQUFBQUFBQUFBQUFBQUFBQUFBQUFBQUFBQUFBQUFBQUFBQUFBQUFBQUFBQUFBQUFBQUFBQUFBQUFBQUFBQUFBQUFBQUFBQUFBQUFBQUFBQUFBQUFBQUFBQUFBQUFBQUFBQUFBQUFBQUFBQUFBQUFBQUFBQUFBQUFBQUFBQUFBQUFBQUFBQUFBQUFBQUFBQUFBQUFBQUFBQUFBQUFBQUFBQUFBQUFBQUFBQUFBQUFBQUFBQUFBQUFBQUFBQUFBQUFBQUFBQUFBQUFBQUFBQUFBQUFBQUFBQUFBQUFBQUFBQUFBQUFBQUFBQUFBQUFBQUFBQUFBQUFBQUFBQUFBQUFBQUFBQUFBQUFBQUFBQUFBQUFBQUFBQUFBQUFBQUFBQUFBQUFBQUFBQUFBQUFBQUFBQUFBQUFBQUFBQUFBQUFBQUFBQUFBQUFBQUFBQUFBQUFBQUFBQUFBQUFBQUFBQUFBQUFBQUFBQUFBQUFBQUFBQUFBQUFBQUFBQUFBQUFBQUFBQUFBQUFBQUFBQUFBQUFBQUFBQUFBQUFBQUFBQUFBQUFBQUFBQUFBQUFBQUFBQUFBQUFBQUFBQUFBQUFBQUFBQUFBQUFBQUFBQUFBQUFBQUFBQUFBQUFBQUFBQUFBQUFBQUFBQUFBQUFBQUFBQUFBQUFBQUFBQUFBQUFBQUFBQUFBQUFBQUFBQUFBQUFBQUFBQUFBQUFBQUFBQUFBQUFBQUFBQUFBQUFBQUFBQUFBQUFBQUFBQUFBQUFBQUFBQUFBQUFBQUFBQUFBQUFBQUFBQUFBQUFBQUFBQUFBQUFBQUFBQUFBQUFBQUFBQUFBQUFBQUFBQUFBQUFBQUFBQUFBQUFBQUFBQUFBQUFBQUFBQUFBQUFBQUFBQUFBQUFBQUFBQUFBQUFBQUFBQUFBQT0iLCJlbmRvcnNlZCI6eyJjcnlwdG9fbWF0ZXJpYWxfaGFzaCI6ImVmMGExZTBlNDU5NjZkNmQxODIxMjg4ZDYwZGRhOTEwYzQ4NGYyZWJiMTFhMDNmMTk2ZTY5YzMxMzI2ODhhYTIiLCJkZXZpY2VfZXZpZGVuY2VfaGFzaCI6IjVlODRmNjMyZTAxMjkzYmZmNDU5NmNmNzJjNDVkZTBmOWUxMDM3ZTVjZGEzMjMyYjg1MGM0NzhkMWE2YjU5MmIifX0sImNyeXB0b19tYXRlcmlhbCI6ImV5Sm1iM0p0WVhRaU9pSm9kSFJ3Y3pvdkwzUnBibVp2YVd3dWMyZ3ZZM0o1Y0hSdkxXMWhkR1Z5YVdGc0wzWXhJaXdpYVhSbGJYTWlPbHQ3SW1sa0lqb2lkR3h6SWl3aVptOXliV0YwSWpvaWFIUjBjSE02THk5MGFXNW1iMmxzTG5Ob0wydGxlUzl6Y0d0cExXWndMWE5vWVRJMU5pOTJNU0lzSW1SaGRHRWlPaUprTVdFek56ZzRPVE13TnpVd01UZzBaakptWlRJMk9HRXlNakppTldNMk5XSmhZamszTkRBMk9UVTNNMk0wWVdaaVpqWTFOalExTkdZd05qWmlObVV6SW4wc2V5SnBaQ0k2SW1od2EyVWlMQ0ptYjNKdFlYUWlPaUpvZEhSd2N6b3ZMM1JwYm1admFXd3VjMmd2YTJWNUwzZ3lOVFV4T1Mxb2NHdGxMM1l4SWl3aVpHRjBZU0k2SWpVNFl6bGlNemMxTm1RM016ZzBOalpoWTJVeFpUSTNaamd6WVRkbVpUSXhZak16TlRabFl6TTJNalk1TkdGbFpqRTFNRFpqTldZek5XTTNOalpoTURFaWZWMTkiLCJkZXZpY2VfZXZpZGVuY2UiOiJleUptYjNKdFlYUWlPaUpvZEhSd2N6b3ZMM1JwYm1admFXd3VjMmd2WkdWMmFXTmxMV1YyYVdSbGJtTmxMM1l4SWl3aWFYUmxiWE1pT2x0ZGZRPT0iLCJjb2xsYXRlcmFsIjpbXX0=",
    "nonce_hex": "000102030405060708090a0b0c0d0e0f101112131415161718191a1b1c1d1e1f",
    "repo": "tinfoilsh/confidential-inference-proxy"
  },
  "expected": {
    "accepted": false,
    "code": "ENVELOPE_REJECTED"
  }
}
